<?xml version="1.0" encoding="UTF-8"?>
<Biblioteca xmlns:xsi="http://www.w3.org/2001/XMLSchema-instance" 
        xsi:noNamespaceSchemaLocation= "BibliotecaXSDSergi.xsd">
<!-- LIBROS-->
  <libro id="L001" tipo_clase="novela" numero_paginas="200">
    <titulo>Historia de los griegos</titulo>
    <capitulo numero_paginas="25">
      <titulo>Capitulo 1º Minos</titulo>
      <contenido informacion="Personajes principales">Entramos en los inicios de la grecia antigua...</contenido>
    </capitulo>
    <capitulo numero_paginas="50">
      <titulo>Capítulo 2 Schliemann</titulo>
      <contenido informacion="El primer día en la Universidad">Falta poco para los hablar de los filosofos ..</contenido>
    </capitulo>
    <sinopsis>La contribución de Grecia a la civilizacion occidental es vasta y facinante.</sinopsis>
    <indice>Prólogo, Capítulo 1, Capítulo 2, Capítulo 3, ...</indice>
  </libro>
  <!-- REVISTA-->
  <revista id="R001" tipo="otros" numero_paginas="100">
    <titulo>Cahiers du cinema</titulo>
    <numero_revista>123</numero_revista>
    <indice_contenido>Entrevistas, análisis, y crítica </indice_contenido>
     <seccion numero_paginas="10">
    <contenidorevista enlace_informacion="https://www.caimanediciones.es/entrevista-alberto-gastesi-version-ampliada-de-caiman-cdc-no-177/">Entrevista a Alberto Gastesi</contenidorevista>
  </seccion>
  <seccion numero_paginas="20">
      <contenidorevista enlace_informacion="https://www.caimanediciones.es/my-sunny-maad-michaela-pavlatova/">Crítica My Sunny Maad d</contenidorevista>
  </seccion>
  </revista>
  <!-- PERIODICO-->
   <periodico tipo_clase="nacional" fecha_publicacion="2023-05-10">
  <seccionperiodico tipo="nacional">
    <articulo autor="Zairzalejos">Una cura para el amor</articulo>
    <articulo autor="Carlos Ansinas">David Suarez contra el humor</articulo>
    <articulo autor="Jorge Javier Vázquez">Isabel Preysley después de muchos años revela sus técnicas filipinas</articulo>
  </seccionperiodico>
  <seccionperiodico tipo="opinion">
    <articulo autor="Beyonce Suárez">¿Por qué tantos adolescentes están solteros?</articulo>
    <articulo autor="Josep Piquet Shakiro">Las vacas amenazan la humanidad</articulo>
  </seccionperiodico>
  <indiceperiodico>Portada, Sociedad, Opinión</indiceperiodico>
  <contenidoperiodico>Sumamos información y entretenimiento.</contenidoperiodico>
</periodico>
</Biblioteca>